interaction,new_y,sentence,explanation
#drug may increase the hepatotoxic activities of #drug.,79,hepatotoxic activities be increased,"encompasses numerous different individual diseases that ultimately lead to progressive damage of the liver, to liver malfunction and death."
#drug may increase the thrombogenic activities of #drug.,80,thrombogenic activities be increased,Thrombosis occurs when there is a breakdown in the balance between thrombogenic factors and protective mechanisms.
#drug may increase the arrhythmogenic activities of #drug.,81,arrhythmogenic activities be increased,the mechanisms that cause abnormal heart rate and rhythm due to either abnormal impulse generation or abnormal impulse conduction.
#drug may increase the hypokalemic activities of #drug.,82,hypokalemic activities be increased,"Abnormally low potassium concentration in the blood. It may result from potassium loss by renal secretion or by the gastrointestinal route, as by vomiting or diarrhea. It may be manifested clinically by neuromuscular disorders ranging from weakness to paralysis, by electrocardiographic abnormalities (depression of the T wave and elevation of the U wave), by renal disease, and by gastrointestinal disorders."
#drug may increase the vasopressor activities of #drug.,83,vasopressor activities be increased,"an agent that raises blood pressure by constricting blood vessels, thereby increasing systemic vascular resistance."
#drug may increase the tachycardic activities of #drug.,84,tachycardic activities be increased,"Abnormally rapid heartbeat, usually with a HEART RATE above 100 beats per minute for adults. Tachycardia accompanied by disturbance in the cardiac depolarization (cardiac arrhythmia) is called tachyarrhythmia."
The risk of a hypersensitivity reaction to #drug is increased when it is combined with #drug.,85,hypersensitivity reaction be increased,"Altered reactivity to an antigen, which can result in pathologic reactions upon subsequent exposure to that particular antigen."
